id,description
53218,"The adoption information center provides information and referral services to adoptive parents, adult adoptees, birth relatives, pregnant women and professionals free of charge."
53230,"Provides foster parent recruitment, adoption services, foster child out of home placement, family team conferences and reunification, and teen independent living programs."
53234,Provides foster care services.
53238,Birth parent counseling to unwed mothers and adoption assistance. Clinical counseling available to Latter Day Saint church members.
53273,"Full day, before and after school, infant care"
53281,Provides clinic with exams by asthma specialists and free medications to all who qualify.
53296,"Provides employment training, computer training, and job placement assistance."
53421,Services and advocacy support for people with disabilities.
53433,The exceptional student education department of the clay county school district is committed to serving the educational needs of all students.